name,Kind,Alcohol,Aroma,Taste,Finish
쿠보타 준마이 다이긴죠,사케,15.0,"배, 사과, 멜론","꽃, 달콤한, 새콤한",은은한
송죽매 교토 준마이,사케,15.0,"달콤한, 바닐라, 진저, 과일","오크, 달콤한","풍부한, 긴 여운"
온나 나카세 준마이 다이긴죠,사케,16.0,은은한,"건포도, 무화과, 바닐라, 과일","부드러운, 긴 여운"
가모츠루 다이긴죠 골드,사케,16.5,과일,"깨끗한, 순수한","풍부한, 긴 여운"
카모시비토 쿠헤이지 오두디지,사케,16.0,"꽃, 풍부한","오크, 달콤한","긴 여운, 풍부한"
쿠보타 센쥬 준마이 긴죠,사케,15.0,은은한,"달콤한, 부드러운, 감칠맛, 산뜻한",부드러운
송죽매 클래식 준마이,사케,15.0,"풋사과, 멜론, 과일, 은은한","감칠맛, 곡물","은은한, 부드러운"
고쿠류 다이긴죠,사케,15.5,"바닐라, 신선한","감칠맛, 곡물",화려한
코시노칸바이 사이,사케,15.0,"멜론, 바나나, 사과, 조화로운","쌀, 바닐라, 흙내음, 미묘한",긴 여운
데와자쿠라 준마이 긴죠,사케,15.0,"향기로운, 과일","달콤한, 감칠맛",온화한
닷사이 준마이 다이긴죠45,사케,16.0,"포도 주스, 달콤한, 꽃","감칠맛, 온화한, 과일, 달콤한",긴 여운
월계관 준마이 750,사케,15.6,과일,달콤한,"깨끗한, 부드러운"
하쿠시카 준마이 긴죠 팩,사케,14.5,산뜻한,달콤한,깔끔한
송죽매 준마이 750,사케,15.0,"풋사과, 멜론, 은은한, 과일","감칠맛, 곡물",상쾌한
마쯔리 텐구 900 팩,사케,14.5,산뜻한,"감칠맛, 부드러운",깔끔한
하쿠쯔루 마루 500 팩,사케,13.5,상큼한,"새콤한, 달콤한",알코올
하쿠쯔루 마루 900 팩,사케,13.5,상큼한,"새콤한, 달콤한",알코올
하나 기자쿠라 준마이 긴죠,사케,12.0,"꽃, 과일","과일, 달콤한","부드러운, 깔끔한"
간바레 오또상 팩,사케,14.5,사과,"달콤한, 새콤한",깔끔한
사사이치 나츠 준마이 긴죠,사케,15.0,"자몽, 파인애플","복숭아, 열대 과일","새콤한, 깔끔한, 달콤한"
핫카이산 다이긴죠,사케,15.5,"쌀, 누룩, 바나나","달콤한, 깔끔한, 멜론","부드러운, 깔끔한"
핫카이산 준마이 다이긴죠,사케,15.5,"쌀, 누룩, 바나나","달콤한, 깔끔한, 멜론","부드러운, 풍부한"
야에가키 준마이,사케,15.0,"쌀, 누룩, 꽃","배, 깔끔한, 순수한",깔끔한
세븐 준마이 다이긴죠,사케,15.0,"둥근, 우아한, 레몬, 꽃, 꿀","부드러운, 허니서클, 천도 복숭아, 꿀","깔끔한, 쑥, 사과"
오카네,사케,13.5,"쌀, 핵과류","부드러운, 쌀, 산미","깔끔한, 산뜻한"
츠루우메 유즈,"리큐르, 사케",7.0,유자,"유자, 달콤한, 상큼한","감칠맛, 부드러운"
키슈호마레 준마이,사케,15.0,"산뜻한, 누룩","상쾌한, 쌀, 감칠맛",경쾌한
토우코우 준마이,사케,15.0,"부드러운, 산뜻한","순수한, 쌀","깔끔한, 담백한"
준마이 북극곰의 눈물,사케,14.5,"쌀, 은은한, 달콤한","달콤한, 감칠맛","부드러운, 깔끔한"
오미네 3 그레인,사케,14.5,"쌀, 뻥튀기, 잘 익은 열대 과일","백도, 머스캣, 사과, 감칠맛","깔끔한, 깨끗한, 달콤한"
비로쿠 토쿠베츠 준마이 하루,사케,17.0,"온화한, 상쾌한, 달콤한","부드러운, 싱그러운, 과일","산뜻한, 깔끔한, 산미"
다카시미즈 준마이 다이긴죠,사케,15.5,"신선한, 과일, 꽃","신선한, 감칠맛, 화려한","부드러운, 균형 잡힌"
상선여수 준마이 다이긴죠 금상 수상주,사케,16.5,"사과, 신선한, 과일","우아한, 부드러운, 깔끔한","깨끗한, 상큼한, 달콤한"
닷사이 준마이 다이긴죠 45,사케,16.0,"정향, 향신료, 몰트, 복숭아, 자스민, 오렌지","달콤한, 석류, 생강, 누룩, 실키","풍부한, 균형 잡힌, 깨끗한"
라쿠 준마이 골드,사케,13.5,"쌀, 누룩, 달콤한, 열대 과일","쌀, 고소한, 스모키, 달콤한, 멜론",깔끔한
호오비덴 제이사케,사케,42.0,"바닐라, 견과류","부드러운, 균형 잡힌, 알코올감","우아한, 깊은"
오토코야마 기타노이나호 다이긴죠,사케,16.0,"화려한, 청사과, 과일, 꽃","부드러운, 담백한, 감칠맛","깨끗한, 깔끔한, 상쾌한"
송죽매 타쿠죠,사케,15.0,"멜론, 풋사과, 참외","부드러운, 쌀, 감칠맛",부드러운
온나 나카세 준마이 다이긴죠,사케,16.0,은은한,"건포도, 과일, 바닐라, 무화과","부드러운, 긴 여운, 풍성한"
쿠보타 준마이 다이긴죠,사케,15.0,"멜론, 배, 사과","꽃, 달콤한, 새콤한",은은한
갓산 사사라츠키,사케,10.5,"산뜻한, 달콤한","감칠맛, 부드러운, 달콤한",깔끔한
사카리 유즈 No.21,"리큐르, 사케",8.0,"유자, 시트러스","유자, 달콤한, 상큼한, 과일",달콤한
쿠보타 만쥬,사케,15.5,"과일, 부드러운, 복합적인, 멜론","균형 잡힌, 복숭아, 꿀, 토피, 후추, 견과류","균형 잡힌, 실키, 부드러운"
닷사이 준마이 다이긴죠 39,사케,16.0,"꽃, 망고, 과일","풍부한, 과일, 부드러운","깔끔한, 풍성한"
닷사이 준마이 다이긴죠 23,사케,16.0,"온화한, 꽃, 꿀, 은은한","경쾌한, 감칠맛","부드러운, 시원한, 깔끔한"
다카시미즈 다이긴죠,사케,15.5,"사과, 배, 바나나, 신선한","산뜻한, 과일, 복합적인, 풍부한","우아한, 달콤한, 감칠맛"
아마부키 하쿠토우슈,사케,8.0,"향긋한, 복숭아, 자두, 달콤한","복숭아, 달콤한",깔끔한
닛코 오니,사케,14.5,"은은한, 쌀",쌀,"부드러운, 깔끔한"
준마이 북극곰의 눈물,사케,14.5,"쌀, 은은한, 달콤한","감칠맛, 달콤한","깔끔한, 부드러운"
쿠보타 만쥬,사케,15.5,"과일, 멜론, 복합적인, 부드러운","견과류, 균형 잡힌, 꿀, 복숭아, 토피, 후추","균형 잡힌, 실키, 부드러운"
닷사이 준마이 다이긴죠 23,사케,16.0,"꽃, 꿀, 온화한, 은은한","감칠맛, 경쾌한","깔끔한, 부드러운, 시원한"
온나 나카세 준마이 다이긴죠,사케,16.0,은은한,"건포도, 과일, 무화과, 바닐라","부드러운, 긴 여운"
츠루우메 유즈 1.8L,"리큐르, 사케",7.0,유자,"달콤한, 유자, 상큼한","감칠맛, 부드러운"
준마이 북극곰의 눈물 크리스마스,사케,14.5,"쌀, 은은한, 달콤한","감칠맛, 달콤한","깔끔한, 부드러운"
사쿠라 준마이,사케,16.0,"꽃, 화려한, 풍성한","깔끔한, 개운한, 풍부한, 달콤한","깔끔한, 신선한, 온화한"
츠루우메 나츠미캉,"리큐르, 사케",7.0,"과일, 감귤","달콤한, 상큼한, 시트러스, 감귤","감귤, 상큼한"
아키토라 준마이 다이긴죠,사케,15.5,"쌀, 꽃, 바닐라","부드러운, 깊은","묵직한, 섬세한"
후쿠이와이 유즈슈,사케,7.5,"유자, 향긋한","달콤한, 유자, 새콤한, 풍부한","산뜻한, 상쾌한"
후쿠이와이 유즈슈 1.8L,사케,7.5,"유자, 향긋한","달콤한, 유자, 새콤한, 풍부한","산뜻한, 상쾌한"
가모츠루 혼죠조 카라쿠치,사케,14.5,"깔끔한, 무향","담백한, 경쾌한","깔끔한, 가벼운"
오제키 스모,사케,13.5,"신선한, 달콤한","쌀, 깔끔한, 상큼한","부드러운, 은은한, 과일"
츠루우메 나츠미캉,"리큐르, 사케",7.0,"감귤, 과일","달콤한, 상큼한, 시트러스, 감귤","감귤, 상큼한"
핫카이산 토쿠베츠 혼죠조,사케,15.5,"쌀, 쌀 고유의 단맛","달콤한, 부드러운",담백한
닷사이 미가키 소노사키에,사케,16.0,"과일, 은은한","복합적인, 오일리한, 부드러운","긴 여운, 깔끔한"
핫카이산 토쿠베츠 준마이,사케,15.5,"쌀, 흰 꽃","부드러운, 깔끔한, 달콤한",긴 여운
닛코 오니 2L,사케,14.5,"은은한, 쌀",쌀,"깔끔한, 부드러운"
시쿤 준마이 긴죠 실버,사케,15.0,"자몽, 상큼한, 감귤, 시트러스","산뜻한, 새콤한, 달콤한, 쌉쌀한","긴 여운, 시트러스, 알코올"
시쿤 준마이 긴죠 블루,사케,15.0,"향기로운, 과일, 쌀, 은은한","풍부한, 새콤한, 달콤한",깔끔한
시쿤 준마이 긴죠 골드피쉬,사케,14.0,"감귤, 은은한","감칠맛, 온화한, 달콤한, 긴 여운, 산뜻한","상쾌한, 균형 잡힌, 깔끔한"
하나비라,사케,15.0,"과일, 산뜻한, 상큼한, 꽃","감칠맛, 상큼한","부드러운, 사과, 산미"
타카키노 잇본 준마이 다이긴죠,사케,15.5,"화려한, 은은한","부드러운, 달콤한","긴 여운, 담백한"
텐구마이 야마하이 준마이,사케,15.9,"농밀한, 은은한","산미, 감칠맛, 깊은",부드러운
준마이 다이긴죠 겐슈 사카마이 기쿠스이,사케,17.0,"상쾌한, 청사과, 꽃","진한, 시트러스","긴 여운, 깔끔한, 산미"
조젠 미즈노 고토시 준마이 긴죠,사케,14.5,"상쾌한, 사과, 배","가벼운, 산미","깔끔한, 바나나, 쌀 고유의 단맛"
우고노츠키 토구베츠 준마이,사케,13.0,"상큼한, 꽃, 과일","가벼운, 쌀 고유의 단맛, 감칠맛","약간의 산미, 깔끔한"
핫카이산 준마이 긴죠 유키무로 초조 산넨,사케,17.0,"사과 파이, 배, 살구","꿀, 부드러운, 깨끗한","깔끔한, 과일, 산미"
요카이치 무기,사케,25.0,"구수한, 보리","깔끔한, 향긋한, 보리",깨끗한
츠카사보탄 야마유즈 시보리 유즈노 사케,사케,8.0,"상쾌한, 상큼한","새콤한, 달콤한","깨끗한, 긴 여운"
포폭스 사케 준마이 다이긴죠,사케,16.0,"깨끗한, 과일, 순수한","우아한, 쌀, 미네랄리티","부드러운, 상쾌한"
메이보 요와노츠키,사케,15.8,"열대 과일, 산뜻한","쌉쌀한, 실키, 감칠맛, 산미","담백한, 부드러운, 조화로운"
오샤베리 쿠지라 리치 앤 스무스,사케,13.0,"배, 사과, 살구","부드러운, 달콤한","가벼운, 은은한"
카오리 하나야구 준마이,사케,15.5,"향긋한, 과일","산미, 달콤한","균형 잡힌, 묵직한"
다카시미즈 죠우센 혼죠조,사케,15.5,"농익은, 우아한","부드러운, 균형 잡힌","포근한, 깔끔한, 부드러운"
오샤베리 쿠지라 라이트 앤 프루티,사케,14.0,"산뜻한, 가벼운, 청포도","과일, 부드러운, 바나나","부드러운, 풍부한, 새콤한, 깔끔한, 달콤한"
니고루루루,사케,7.0,"유자, 상큼한, 매실","달콤한, 부드러운, 새콤한","균형 잡힌, 균형 잡힌"
키타야 유메잇콘 토쿠베츠 준마이,사케,15.5,"신선한, 과일","풍부한, 쌀","감칠맛, 부드러운, 맑은"
세이슈 미도리카와,사케,15.5,"은은한, 부드러운","맑은, 균형 잡힌",깨끗한
슈호 토쿠베츠준마이 아오빙,사케,15.0,"신선한, 과일, 상큼한","부드러운, 꽃","산미, 깔끔한"
센킨 무쿠 준마이 다이긴죠,사케,15.5,"오렌지, 사과, 시트러스","달콤한, 부드러운, 상큼한, 가벼운","은은한, 깔끔한"
쿠로네코 준마이 긴죠,사케,15.0,"곡물, 청아한, 시원한","감칠맛, 섬세한, 우아한","풍부한, 부드러운, 긴 여운"
시로네코 준마이,사케,15.0,"곡물, 풀잎, 배, 달콤한","감칠맛, 부드러운, 달콤한","깔끔한, 담백한, 부드러운"
쿠보타 만쥬,사케,15.2,"과일, 부드러운, 복합적인, 멜론","균형 잡힌, 복숭아, 꿀, 토피, 후추, 견과류","균형 잡힌, 실키, 부드러운"
다이긴죠 히야시보리,사케,15.5,"상쾌한, 풍부한, 과일, 은은한, 달콤한","신선한, 감칠맛, 곡물, 은은한","조화로운, 부드러운"
심백 야마다니시키 준마이 다이긴죠,사케,16.0,"화려한, 은은한, 달콤한","부드러운, 쌀 고유의 단맛",깔끔한
준마이 북극곰의 눈물 벚꽃,사케,14.5,"쌀, 은은한, 순수한","감칠맛, 달콤한, 산뜻한","깔끔한, 부드러운"
하루시카 사쿠라 준마이,사케,15.0,"온화한, 은은한, 곡물, 꽃, 풍부한","감칠맛, 상쾌한","깊은, 눅진한, 달콤한"
코시노츠루 준마이 다이긴죠 도메누 나마,사케,16.0,"과일, 신선한","꽃, 풍부한, 감칠맛","부드러운, 은은한"
쿠보타 설봉 W 500m,사케,14.0,"은은한, 머스캣, 멜론","묵직한, 감칠맛, 쌀 고유의 단맛","긴 여운, 부드러운"
반샤쿠 500,사케,13.5,"은은한, 달콤한, 깨끗한","부드러운, 쌀 고유의 단맛, 감칠맛","깔끔한, 부드러운"
대관컵,사케,14.0,"깔끔한, 산뜻한, 누룩","달콤한, 과일, 쌀","부드러운, 달콤한"
고래 300,사케,15.0,"곡물, 산뜻한, 은은한","쌀, 부드러운","깔끔한, 신선한, 온화한"
센,사케,13.5,"신선한, 과일, 은은한, 달콤한","부드러운, 누룩, 감칠맛","깔끔한, 가벼운, 약간의 산미"
나마죠조 실버,사케,12.8,"쌀, 배, 멜론","바나나, 섬세한, 부드러운","달콤한, 상쾌한, 잘 익은 과일"
신세이 다이긴죠,사케,15.5,"배, 사과, 멜론, 꽃","감칠맛, 새콤한, 달콤한","은은한, 깔끔한"
코타카라 망고,"리큐르, 사케",8.0,"망고, 열대 과일, 달콤한","망고, 상큼한, 꿀","부드러운, 과일, 산미"
코타카라 자두,"리큐르, 사케",8.0,"상큼한, 과일, 진한","풍부한, 자두, 달콤한","깔끔한, 우아한, 산미"
죠키겐 유즈슈,"리큐르, 사케",8.0,"유자, 과일, 상큼한","쌀, 가벼운, 상큼한","상쾌한, 시트러스, 달콤한"
아마노토 준마이 다이긴죠 45,사케,16.5,"곡물, 풀내음, 누룩","달콤한, 감칠맛, 쌀, 꿀","배, 깔끔한"
마스미 산카,사케,15.0,"꽃, 사과, 배","쌀 고유의 단맛, 감칠맛, 곡물","싱그러운, 복합적인, 깔끔한"
마스미 아카,사케,15.0,"요거트, 은은한, 달콤한, 청포도","사과, 배, 상큼한","깔끔한, 긴 여운, 산뜻한"
마스미 쿠로,사케,15.0,"사과, 쌀, 누룩","바나나, 감칠맛","부드러운, 깔끔한, 섬세한"
요카이치 무기,사케,25.0,"보리, 구수한","보리, 향긋한, 깔끔한","깨끗한, 담백한"
사카마이 기쿠스이 준마이 다이긴죠,사케,15.0,"상쾌한, 청사과, 꽃","감칠맛, 시트러스","긴 여운, 상큼한, 과일"
네노히 오이시이 준마이,사케,13.5,"산뜻한, 청사과, 은은한","부드러운, 쌀, 감칠맛","달콤한, 가벼운, 깔끔한"
쿠보타 만쥬 자사효모,사케,15.0,"쌀, 누룩, 바나나","사과, 바닐라, 감칠맛","복합적인, 달콤한, 부드러운"
센킨 아카톤보 히야오로시,사케,14.0,"머스캣, 온화한","둥근, 달콤한, 부드러운","긴 여운, 부드러운"
이와 5 아쌍블라주 2,블렌디드 사케,15.7,"민트, 아니스, 누룩","허브, 곡물, 쌀","따뜻한, 긴 여운, 부드러운"
쇼치쿠바이 텐,사케,13.0,"쌀, 구수한, 달콤한","감칠맛, 산미","깔끔한, 가벼운"
센노유메 팩,사케,14.0,"풍부한, 과일, 달콤한","가벼운, 상큼한","부드러운, 감칠맛, 깔끔한"
심야식당 준마이,사케,13.5,"누룩, 쌀, 누룽지","곡물, 달콤한, 감칠맛","부드러운, 진한, 긴 여운"
미이노코토부키 준마이긴죠 +14 오카라구치,사케,14.0,"누룩, 균형 잡힌","쌀, 감칠맛, 달콤한","부드러운, 감칠맛, 깔끔한"
라쿠엔 유즈슈,"사케, 리큐르",8.5,"유자, 향긋한","유자, 달콤한","가벼운, 상쾌한"
쿠보타 만쥬,사케,15.2,"과일, 멜론, 복합적인, 부드러운","견과류, 꿀, 복숭아, 토피, 후추, 균형 잡힌","부드러운, 실키, 균형 잡힌"
닷사이 준마이 다이긴죠 23,사케,16.0,"온화한, 꽃, 꿀, 은은한","경쾌한, 감칠맛","시원한, 깔끔한, 부드러운"
요네츠루 준마이 안단테,사케,12.0,"상쾌한, 과일, 꽃","달콤한, 가벼운, 부드러운","은은한, 쌀, 산미, 감칠맛"
키쿠스이 가라구치,사케,15.0,"깔끔한, 요거트, 청사과","가벼운, 균형 잡힌","감칠맛, 산미, 상쾌한"
다카시미즈 준마이 겐테이,사케,15.3,"신선한, 과일, 꽃","부드러운, 달콤한, 단단한 구조감","흙내음, 가벼운, 은은한"
초카라구치 2L,사케,14.5,"신선한, 은은한, 과일, 상큼한","부드러운, 깔끔한, 상큼한","깔끔한, 산미"
츠루우메 유즈,"리큐르, 사케",7.0,유자,"달콤한, 상큼한, 유자","감칠맛, 부드러운"
준마이 북극곰의 눈물 벚꽃,사케,14.5,"순수한, 쌀, 은은한","감칠맛, 달콤한, 산뜻한","깔끔한, 부드러운"
닷사이 준마이 다이긴죠 45,사케,16.0,"정향, 향신료, 복숭아, 자스민, 오렌지, 몰트","달콤한, 석류, 생강, 누룩, 실키","풍부한, 균형 잡힌, 깨끗한"
츠루우메 유즈 1.8L,"리큐르, 사케",7.0,유자,"달콤한, 상큼한, 유자","감칠맛, 부드러운"
고쿠류 다이긴죠 크리스탈 드래곤,사케,16.0,"사과, 멜론, 파인애플","감칠맛, 차","꿀, 부드러운, 긴 여운"
고쿠류 준마이 긴죠,사케,15.5,"오렌지 껍질, 견과류, 코코넛, 생강","진한, 균형 잡힌","쌉쌀한, 감칠맛, 말린 과일, 곡물"
고쿠류 준긴 타레구치,사케,17.0,"산뜻한, 과일, 청사과","달콤한, 시트러스, 쌀","은은한, 가벼운, 상쾌한"
오제키 노모노모 사케,사케,13.5,"산뜻한, 청사과, 은은한","가벼운, 쌀, 감칠맛","깔끔한, 상쾌한, 달콤한"
아마노토 준마이 다이긴죠45,사케,16.5,"상쾌한, 쌀","깨끗한, 깔끔한, 효모","긴 여운, 배"
고베 1717,사케,13.5,"쌀, 과일, 달콤한, 은은한","멜론, 배, 산뜻한","섬세한, 깊은, 깔끔한"
신 유즈,"사케, 리큐르",8.0,"라임, 레모네이드, 감귤","유자, 감귤, 레몬","산뜻한, 달콤한, 부드러운"
다카시미즈 사케노쿠니 준마이,사케,15.3,"상쾌한, 향긋한, 쌀","부드러운, 감칠맛, 중후한","달콤한, 은은한, 흙내음"
준마이 북극곰의 눈물,사케,14.5,"쌀, 은은한","감칠맛, 달콤한","깔끔한, 부드러운"
쿠보타 만쥬,사케,15.2,"과일, 부드러운, 복합적인, 멜론","복숭아, 꿀, 토피, 후추, 견과류","균형 잡힌, 실키, 부드러운"
햐쿠모쿠 준마이 긴죠,사케,15.0,"곡물, 바나나","약간의 산미, 화려한, 쌀","감칠맛, 깔끔한"
준마이 다이긴죠 더 코키,사케,15.0,"쌀, 감칠맛, 쌀 고유의 단맛","메론, 배","상쾌한, 깔끔한, 부드러운"
키쿠마사무네 시보리다테 실버 팩,사케,14.5,"자몽, 멜론, 백후추","가벼운, 부드러운","긴 여운, 사과, 깨끗한"
고키겐 쵸상,사케,15.0,"달콤한, 은은한, 과일","묵직한, 감칠맛","긴 여운, 풍부한, 향긋한"
하나비라,사케,15.0,"과일, 산뜻한, 상큼한","감칠맛, 상큼한","사과, 산미"
햐쿠모쿠 Alt.3,사케,15.5,"잘 익은 배, 멜론, 누가, 쌀","복합적인, 화려한, 곡물","신선한, 부드러운, 깔끔한"
월계관 나마죠조,사케,13.5,"신선한, 가벼운, 과일","경쾌한, 산뜻한, 감칠맛","깔끔한, 부드러운, 상큼한"
월계관 더 컵,사케,14.0,"과일, 상쾌한, 깔끔한","달콤한, 균형 잡힌, 깊은","깨끗한, 부드러운, 감칠맛"
하쿠시카 혼죠조 팩,사케,15.3,"산뜻한, 향긋한, 부드러운","미디엄 드라이, 상쾌한, 감칠맛","가벼운, 깔끔한, 은은한"
하쿠시카 쿠로마츠 준마이 모치요단,사케,14.5,"가벼운, 은은한, 꽃","부드러운, 섬세한, 감칠맛","깔끔한, 미묘한, 깨끗한"
록카센 스이카노 사케,사케,8.5,"과일, 청량한, 수박","달콤한, 시원한, 상큼한","맑은, 가벼운, 향긋한"
키쿠마사무네 실버 팩,사케,14.5,"자몽, 멜론, 백후추","부드러운, 사과, 깨끗한","긴 여운, 부드러운, 담백한"
노호홍 사케,사케,13.5,"신선한, 은은한, 달콤한","쌀, 부드러운, 담백한","가벼운, 깔끔한, 감칠맛"
오우곤코우시 금박주,사케,13.5,"신선한, 꽃, 사과","담백한, 균형 잡힌, 부드러운","깔끔한, 은은한, 감칠맛"
하쿠시카 긴죠 나마죠조,사케,13.5,"상큼한, 청사과, 바나나","부드러운, 담백한, 깔끔한","풍부한, 산뜻한, 과일"
카미코코로 준긴 후유노츠키,사케,16.0,"화려한, 꽃, 쌀","부드러운, 깊은, 감칠맛","긴 여운, 풍부한, 깔끔한"
니시노세키 쿠니사키 토쿠베츠 혼죠조,사케,15.0,"부드러운, 상큼한, 누룩","진한, 감칠맛, 산미","미묘한, 은은한, 균형 잡힌"
호화 준마이 다이긴죠 천년수,사케,15.5,"과일, 상쾌한, 섬세한","깊은, 깔끔한, 부드러운","균형 잡힌, 가벼운, 감칠맛"
하쿠시카 토쿠베츠 준마이,사케,14.5,"상쾌한, 강렬한, 시트러스","부드러운, 감칠맛, 묵직한","깔끔한, 쌀, 산뜻한"
월계관 죠센 다루사케,사케,15.5,"삼나무, 신선한, 풍부한","쌀, 달콤한, 균형 잡힌","오크, 산미, 가벼운"
월계관 죠센,사케,15.0,"가벼운, 깔끔한, 시트러스","부드러운, 감칠맛, 균형 잡힌","미네랄리티, 산미, 은은한"
카모시비토 쿠헤이지 오두디지,사케,16.0,"풍부한, 꽃","오크, 달콤한","풍부한, 긴 여운,"
카라구치 우오누마 준마이,사케,15.5,"쌀, 누룩, 곡물","쌀 고유의 단맛, 고소한, 배","부드러운, 깔끔한, 미디엄 드라이"
카가미야마 준마이,사케,15.5,"조화로운, 향긋한, 우아한","풍부한, 감칠맛, 곡물","긴 여운, 감칠맛, 은은한"
우메니시키 카타리츠쿠세 준마이긴죠,사케,16.5,"가벼운, 쌀, 과일","부드러운, 산미, 균형 잡힌","깔끔한, 은은한, 향긋한"
텐란잔 카라구치 준마이,사케,15.0,"가벼운, 과일, 은은한","담백한, 감칠맛, 스파이시","긴 여운, 감칠맛, 상쾌한"
키쿠스이 준마이,사케,15.0,"신선한, 선명한, 향긋한","풍부한, 감칠맛, 쌀","깔끔한, 가벼운, 상큼한"
쿠보타 만쥬,사케,15.2,"과일, 부드러운, 복합적인, 멜론","균형 잡힌, 복숭아, 꿀, 토피, 후추, 견과류","균형 잡힌, 부드러운, 실키"
에치고 츠루가메 와인효모 지코 준마이 다이긴죠,사케,13.0,"화사한, 청포도, 흰 꽃","진한, 달콤한, 산미","우아한, 상쾌한, 상큼한"
니고루루루,사케,7.0,"유자, 상큼한, 매실","새콤한, 달콤한, 부드러운","균형 잡힌, 균형 잡힌"
키모토 준마이 다이긴죠 사토노호마레 무로카,사케,15.5,"신선한, 과일, 우아한","깊은, 풍부한, 감칠맛","부드러운, 꽃, 상쾌한"
핑 팩,사케,14.5,"꽃, 상쾌한, 풍부한","감칠맛, 부드러운, 곡물","담백한, 균형 잡힌, 깔끔한"
오제키 스모,사케,13.5,"신선한, 달콤한, 과일","쌀, 깔끔한, 상큼한","부드러운, 은은한, 산뜻한"
스다치 레이슈,"사케, 리큐르",10.0,"레몬, 귤, 라임","상큼한, 시트러스, 산미","가벼운, 깔끔한, 산미"
히카리 마사무네 팩,사케,14.5,"꽃, 쌀, 곡물","담백한, 감칠맛, 향긋한","은은한, 깔끔한, 상쾌한"
고키겐 쵸상,사케,15.5,"쌀, 은은한, 꽃","감칠맛, 부드러운, 쌀 고유의 단맛","가벼운, 고소한, 깔끔한"
오니고로시팩,사케,14.0,"꽃, 은은한, 쌀","산뜻한, 쌀 고유의 단맛, 곡물","부드러운, 깔끔한, 깨끗한"
에치고야 소베이 준마이,사케,15.5,"곡물, 산뜻한, 쌀","깊은, 상쾌한, 쌀 고유의 단맛","미디엄 드라이, 은은한, 긴 여운"
츠루우메 슷빠이,"리큐르, 사케",11.0,"매실, 상큼한, 달콤한","가벼운, 새콤한, 감칠맛","부드러운, 깔끔한, 산미"
온나 나카세 준마이 다이긴죠,사케,16.5,은은한,"건포도, 무화과, 바닐라, 과일","긴 여운, 부드러운"
하쿠쯔루 쿠츠로기노 아마구치,사케,13.5,"라벤더, 부드러운, 은은한","달콤한, 시트러스, 감칠맛","달콤한, 약간의 산미, 과일"
준마이팩,사케,14.5,"산뜻한, 과일, 깊은","담백한, 부드러운, 쌀","진한, 우아한, 긴 여운"
유메노 파이토,사케,13.5,"가벼운, 상큼한, 과일","신선한, 담백한, 감칠맛","쌀, 은은한, 산미"
로크노 죠젠 준마이,사케,10.5,"과일, 부드러운, 상큼한","진한, 달콤한, 감칠맛","긴 여운, 달콤한, 산미"
잇파쿠 스이세이 준마이 긴죠 미야마니시키,사케,16.5,"프루티, 산뜻한, 화려한","달콤한, 깔끔한, 복숭아","배, 사과, 상쾌한"
슈퍼레또,사케,13.5,"과일, 신선한, 흰 꽃","담백한, 가벼운, 상쾌한","개운한, 깔끔한, 감칠맛"
히카리 마사무네 팩,사케,14.5,"깔끔한, 쌀, 순수한","청량감, 부드러운, 쌉쌀한","깨끗한, 담백한, 부드러운"
준마이 클래식,사케,15.5,"진한, 강렬한, 쌀","부드러운, 감칠맛, 깊은","화려한, 은은한, 향긋한"
포폭스 사케 준마이 다이긴죠,사케,16.0,"깨끗한, 순수한, 과일","쌀, 우아한, 미네랄리티","상쾌한, 부드러운"
간바레 오또상 팩,사케,14.5,사과,"새콤한, 달콤한",깔끔한
쿠보타 만쥬,사케,15.5,"과일, 부드러운, 복합적인, 멜론","복숭아, 꿀, 토피, 후추, 견과류, 균형 잡힌","부드러운, 실키, 균형 잡힌"
소호마레 기모토 준마이 다이긴죠,사케,16.0,"우아한, 화려한, 꽃","깊은, 쌀, 감칠맛, 산미","산뜻한, 담백한, 은은한"
아베칸 다이긴죠,사케,15.0,"과일, 화려한, 풍부한","진한, 선명한, 감칠맛","가벼운, 달콤한, 부드러운"
츠루우메 나츠미캉 1.8L,"리큐르, 사케",7.0,"과일, 감귤","달콤한, 감귤, 상큼한, 시트러스","감귤, 상큼한"
