name,Kind,Alcohol,Aroma,Taste,Finish
오니 레이슈,사케,13.5,"고소한, 향긋한, 꽃","깔끔한, 은은한, 감칠맛","가벼운, 부드러운, 시원한"
히카리 마사무네,사케,14.9,"은은한, 화사한, 꽃","알코올, 고소한, 감칠맛","깔끔한, 부드러운, 가벼운"
키쿠마사무네 시보리다테 다이긴죠,사케,15.5,"풍부한, 과일, 화사한","가벼운, 산미, 감칠맛","부드러운, 은은한, 깔끔한"
잇파쿠 스이세이 프리미엄,사케,16.2,"쌀, 깨끗한, 은은한","드라이한, 산미, 감칠맛","깔끔한, 부드러운, 균형 잡힌"
코자에몽 준마이 유즈,"리큐르, 사케",8.5,"새콤한, 달콤한, 유자","상큼한, 가벼운, 과일 주스","부드러운, 은은한, 고소한"
센킨 오하나미 사쿠라,사케,14.0,"향긋한, 꽃, 쌀","고소한, 은은한, 감칠맛","화려한, 산뜻한, 깔끔한"
키노 2,사케,16.0,"고소한, 버섯, 쌀","향긋한, 쌀 고유의 단맛, 감칠맛","가벼운, 은은한, 부드러운"
타비카 토끼 2023,사케,15.0,"감귤류, 은은한","부드러운, 달콤한, 시트러스","신선한, 감귤, 긴 여운"
키쿠마사무네 시보리다테 준마이 코우조,사케,15.0,"화려한, 강렬한, 향긋한","고소한, 은은한, 감칠맛","가벼운, 깔끔한, 부드러운"
하나미노 죠젠 준마이긴죠,사케,15.5,"향긋한, 화려한, 꽃","쌀 고유의 단맛, 쌉쌀한, 감칠맛","부드러운, 상쾌한, 깔끔한"
쿠보타 만쥬,사케,15.0,"과일, 부드러운, 복합적인, 멜론","균형 잡힌, 복숭아, 꿀, 토피, 후추, 견과류","균형 잡힌, 부드러운, 실키"
네코 사케 프리미엄,사케,13.8,"신선한, 시트러스, 산뜻한","가벼운, 청량한, 깨끗한","부드러운, 깔끔한, 신선한"
오와리 치타노 오니고로시,사케,15.5,"시원한, 깊은","쌉쌀한, 새콤한, 가벼운","감칠맛, 부드러운, 쌉쌀한"
소호마레 모쿠렌 긴죠슈,사케,15.0,"쌀, 시트러스, 은은한","맑은, 부드러운, 스파이시","담백한, 깔끔한, 우아한"
니찌니찌,사케,16.0,"부드러운, 달콤한, 과일","신선한, 달콤한, 은은한","선명한, 산미, 깔끔한"
다나카 65 아와다나카 D 제로 K65,사케,13.0,"상쾌한, 쌀, 멜론","풍부한, 감칠맛, 상쾌한","은은한, 달콤한, 긴 여운"
타비카 준마이 긴죠 말릭 에시드,사케,13.0,"라임, 곡물, 미묘한","사과, 상쾌한, 가벼운","상큼한, 깔끔한, 시트러스"
마스미 혼죠조 토쿠센,사케,15.0,"산뜻한, 은은한, 쌀","우아한, 산미, 곡물","조화로운, 깔끔한, 경쾌한"
쿠보타 나마겐슈,사케,19.0,"과일, 복합적인, 멜론","복숭아, 은은한 후추, 견과류","부드러운, 균형 잡힌, 실키"
오미네 2 그레인,사케,14.5,"흰 꽃, 복숭아, 신선한","쌀, 달콤한, 부드러운","은은한, 향긋한, 균형 잡힌"
잇파쿠 스이세이 준마이 긴죠 미사토니시키,사케,16.0,"쌀, 과일, 산뜻한","프루티, 감칠맛, 농밀한","감칠맛, 신선한, 산뜻한"
준마이 다이긴죠 더 후쿠라,사케,15.0,"풍부한, 과일, 신선한, 은은한","깊은, 부드러운, 쌀","균형 잡힌, 선명한, 깔끔한"
상선여수 신마이신슈노 죠젠 준마이 긴죠,사케,16.5,"신선한, 화려한, 쌀","감칠맛, 경쾌한, 쌀 고유의 단맛","부드러운, 우아한, 깔끔한"
코자에몽 토리 라벨 준마이 긴죠,사케,15.5,"쌀, 감칠맛, 상큼한","부드러운, 가벼운, 유자","부드러운, 풍부한, 깔끔한"
타비카 준마이 긴죠 오마치,사케,16.0,"상쾌한, 화려한, 과일","균형 잡힌, 달콤한, 감칠맛","긴 여운, 산미, 깊은"
타비카 준마이슈,사케,16.0,"싱그러운, 과일, 부드러운","은은한, 쌀, 감칠맛","담백한, 깔끔한, 산미"
아베칸 준마이 카라구치,사케,15.0,"상쾌한, 과일, 산뜻한","담백한, 선명한, 감칠맛","깔끔한, 은은한, 산미"
잇파쿠 스이세이 선데이 백 나인,사케,16.0,"은은한, 부드러운, 과일","풍부한, 매끄러운, 달콤한","산뜻한, 산미, 쌀"
잇파쿠 스이세이 토쿠베츠 준마이 료우신,사케,15.5,"과일, 향긋한, 신선한","풍부한, 쌀, 감칠맛","깔끔한, 부드러운, 조화로운"
다나카 로쿠쥬고,사케,15.0,"부드러운, 잘 익은 과일, 멜론","쌀, 감칠맛, 산미","가벼운, 산뜻한, 쌉쌀한"
이와 5 아쌍블라주 3,사케,15.7,"밝은, 꽃, 백후추","균형 잡힌, 핵과류, 미묘한, 허브","복합적인, 견과류, 민트, 향신료"
